{
  "reviewer": "coordinator",
  "reviewed_at": "2026-10-29T03:53:23.455Z",
  "validation": {
    "status": "complete",
    "reason": "Pruebas Node22/24 y regresión final aprobadas con fixtures explícitos.",
    "sources": [
      ".harness_work/initiatives/20261029_proportional_delivery/evidence/optional-node22.log",
      ".harness_work/initiatives/20261029_proportional_delivery/evidence/native-node24.log",
      ".harness_work/initiatives/20261029_proportional_delivery/evidence/final-node24.log",
      ".harness_work/initiatives/20261029_proportional_delivery/evidence/final-closure-regression.log"
    ]
  },
  "reviews": {
    "status": "complete",
    "reason": "Revisión independiente y auditoría resueltas.",
    "sources": [
      ".harness_work/initiatives/20261029_proportional_delivery/reviews/track-review.md",
      ".harness_work/initiatives/20261029_proportional_delivery/audit.md"
    ]
  },
  "documentation": {
    "status": "complete",
    "reason": "Arquitectura y ciclo vigentes consolidados.",
    "sources": [
      "docs/architecture/agent-execution.md",
      "docs/architecture/work-lifecycle.md"
    ]
  },
  "decisions": {
    "status": "complete",
    "reason": "Tres recorridos y compatibilidad explicitados.",
    "sources": [
      "docs/governance/decisions/0017-proportional-delivery-tracks.md"
    ]
  },
  "invariants": {
    "status": "complete",
    "reason": "Pisos críticos y proporcionalidad preservados.",
    "sources": [
      "docs/invariants.md"
    ]
  },
  "roadmap": {
    "status": "complete",
    "reason": "Capacidad proporcional entregada.",
    "sources": [
      "docs/roadmap/README.md"
    ]
  },
  "backlog": {
    "status": "complete",
    "reason": "Adopción real y extensiones permanecen como siguientes resultados.",
    "sources": [
      "docs/roadmap/backlog.md"
    ]
  },
  "memory": {
    "status": "complete",
    "reason": "Contexto limpio y rutas para trabajo nuevo.",
    "sources": [
      ".harness_work/memory/current.md"
    ]
  }
}
