{
  "reviewer": "coordinator",
  "reviewed_at": "2026-10-28T23:20:13.313Z",
  "validation": {
    "status": "complete",
    "reason": "Suites Node22/24 y clientes reales/recorridos mixtos aprobados.",
    "sources": [
      ".harness_work/initiatives/20261028_ejecucion_agentes/evidence/native-node24.log",
      ".harness_work/initiatives/20261028_ejecucion_agentes/evidence/optional-node22.log",
      ".harness_work/initiatives/20261028_ejecucion_agentes/evidence/agent-clients.log",
      ".harness_work/initiatives/20261028_ejecucion_agentes/evidence/agent-mixed-codex.log",
      ".harness_work/initiatives/20261028_ejecucion_agentes/evidence/agent-mixed-claude.log"
    ]
  },
  "reviews": {
    "status": "complete",
    "reason": "Hallazgos B1-B7 corregidos y revalidados; auditor\u00eda sin pendientes.",
    "sources": [
      ".harness_work/initiatives/20261028_ejecucion_agentes/reviews/agent-contracts.md",
      ".harness_work/initiatives/20261028_ejecucion_agentes/reviews/2026-10-28-branch-quality-review.md",
      ".harness_work/initiatives/20261028_ejecucion_agentes/coverage.md"
    ]
  },
  "documentation": {
    "status": "complete",
    "reason": "Contrato vigente independiente del expediente.",
    "sources": [
      "docs/architecture/agent-execution.md"
    ]
  },
  "decisions": {
    "status": "complete",
    "reason": "Configuraci\u00f3n por autoridad y adaptadores expl\u00edcitos.",
    "sources": [
      "docs/governance/decisions/0016-uniform-agent-execution.md"
    ]
  },
  "invariants": {
    "status": "complete",
    "reason": "Ownership, contexto y permisos separados, runtime nativo y l\u00edmites de revisi\u00f3n.",
    "sources": [
      "docs/invariants.md"
    ]
  },
  "roadmap": {
    "status": "complete",
    "reason": "Capacidad entregada de alto nivel.",
    "sources": [
      "docs/roadmap/README.md"
    ]
  },
  "backlog": {
    "status": "complete",
    "reason": "Adopci\u00f3n real y extensi\u00f3n Pi permanecen fuera alcance primera versi\u00f3n.",
    "sources": [
      "docs/roadmap/backlog.md"
    ]
  },
  "memory": {
    "status": "complete",
    "reason": "Retirado trabajo activo y punto de entrada actualizado.",
    "sources": [
      ".harness_work/memory/current.md"
    ]
  }
}
