{
  "reviewer": "coordinador, con revisiones independientes de distribution y lifecycle",
  "reviewed_at": "2026-10-28T04:59:50.816Z",
  "validation": {
    "status": "complete",
    "reason": "Suite completa, gate de versión, pilotos Docker y discovery real de ambas CLI aprobados con exit 0.",
    "sources": [".harness_work/initiatives/20261028_transformacion_framework_harness/evidence/final-validation.log", ".harness_work/initiatives/20261028_transformacion_framework_harness/evidence/final-clients.log"]
  },
  "reviews": {
    "status": "complete",
    "reason": "Revisión independiente de seguridad y calidad: defectos corregidos/revalidados y ningún bloqueante pendiente.",
    "sources": [".harness_work/initiatives/20261028_transformacion_framework_harness/reviews/security.md", ".harness_work/initiatives/20261028_transformacion_framework_harness/reviews/2026-10-28-0434-branch-quality-review.md"]
  },
  "documentation": {
    "status": "complete",
    "reason": "Arquitectura, contratos y operación describen el estado implementado sin depender del expediente.",
    "sources": ["docs/README.md", "docs/architecture/overview.md", "docs/architecture/consumer-contract.md", "docs/architecture/distribution.md", "docs/architecture/work-lifecycle.md"]
  },
  "decisions": {
    "status": "complete",
    "reason": "Layout productor/consumidor, continuidad, ownership, recuperación y presupuestos conservan razones en ADR duraderos.",
    "sources": ["docs/governance/decisions/0013-project-harness.md", "docs/governance/decisions/0014-safe-harness-operations.md"]
  },
  "invariants": {
    "status": "complete",
    "reason": "Índice canónico enlaza aislamiento, contexto, fuentes únicas, ownership y preservación de información.",
    "sources": ["docs/invariants.md"]
  },
  "roadmap": {
    "status": "complete",
    "reason": "Capacidades entregadas se registran a alto nivel; publicación y disponibilidad externa permanecen separadas.",
    "sources": ["docs/roadmap/README.md"]
  },
  "backlog": {
    "status": "complete",
    "reason": "Evolución posterior de adopción real, clientes, stacks y autenticidad tiene ubicación permanente; ningún pendiente bloquea el alcance entregado.",
    "sources": ["docs/roadmap/backlog.md", "docs/governance/pending-decisions.md"]
  },
  "memory": {
    "status": "complete",
    "reason": "No hay trabajadores ni desarrollo activo; prioridades futuras se consultan en fuentes duraderas sin cargar esta iniciativa.",
    "sources": [".harness_work/memory/current.md"]
  }
}
