{
  "reviewer": "coordinador con revisiones independientes funcional/logging y seguridad de caché",
  "reviewed_at": "2026-10-29T16:17:10.309Z",
  "validation": {
    "status": "complete",
    "reason": "Node24 nativo, lint y veinticinco suites aprobadas; end-to-end real Linuxx64 sin dependencias previas y reuso offline",
    "sources": [
      ".harness_work/initiatives/20261029_unified_setup/evidence/native-node24.log",
      ".harness_work/initiatives/20261029_unified_setup/evidence/real-setup.log"
    ]
  },
  "reviews": {
    "status": "complete",
    "reason": "Defectos de caché y normalización corregidos y revalidados; UI/UX de producto no aplican",
    "sources": [
      ".harness_work/initiatives/20261029_unified_setup/reviews/functional.md",
      ".harness_work/initiatives/20261029_unified_setup/reviews/security.md"
    ]
  },
  "documentation": {
    "status": "complete",
    "reason": "Operación unificada y límites mantenidos en fuentes canónicas",
    "sources": [
      "docs/architecture/assurance.md",
      "docs/architecture/consumer-contract.md"
    ]
  },
  "decisions": {
    "status": "complete",
    "reason": "Preparación explícita, herramientas versionadas y caché dedicada sin mutar instalaciones personales",
    "sources": [
      "docs/architecture/assurance.md"
    ]
  },
  "invariants": {
    "status": "complete",
    "reason": "Controles incompletos no aprueban y no amplían autorización operativa",
    "sources": [
      "docs/invariants.md"
    ]
  },
  "roadmap": {
    "status": "complete",
    "reason": "Capacidad de preparación unificada entregada; adopción real separada",
    "sources": [
      "docs/roadmap/README.md"
    ]
  },
  "backlog": {
    "status": "complete",
    "reason": "Adopción y contratos especializados siguen pendientes según gobernanza",
    "sources": [
      "docs/governance/pending-decisions.md"
    ]
  },
  "memory": {
    "status": "complete",
    "reason": "Punto activo retirado, workers terminados y entrada actual de uso disponible",
    "sources": [
      ".harness_work/memory/current.md"
    ]
  }
}
