{
  "reviewer": "coordinador con revisiones independientes de contratos, seguridad, logging e integración",
  "reviewed_at": "2026-10-29T15:44:31.722Z",
  "validation": {
    "status": "complete",
    "reason": "Node24.18.0 nativo, suite completa con lint y veintidós suites exit0; Gitleaks8.30.1 y SOPS3.13.3 reales sin datos productivos",
    "sources": [
      ".harness_work/initiatives/20261029_assurance_controls/evidence/native-node24.log"
    ]
  },
  "reviews": {
    "status": "complete",
    "reason": "Revisiones cruzadas terminadas; bloqueantes corregidos y revalidados; UI/UX de producto no aplican",
    "sources": [
      ".harness_work/initiatives/20261029_assurance_controls/reviews/security.md",
      ".harness_work/initiatives/20261029_assurance_controls/reviews/functional.md",
      ".harness_work/initiatives/20261029_assurance_controls/reviews/contracts.md"
    ]
  },
  "documentation": {
    "status": "complete",
    "reason": "Guías y arquitectura actuales describen operación y límites sin evidencia temporal",
    "sources": [
      "docs/architecture/assurance.md"
    ]
  },
  "decisions": {
    "status": "complete",
    "reason": "Autoridad, alcance, herramientas fijadas y gates operativos explicados en fuente canónica",
    "sources": [
      "docs/architecture/assurance.md"
    ]
  },
  "invariants": {
    "status": "complete",
    "reason": "Controles incompletos no aprueban ni autorizan operaciones",
    "sources": [
      "docs/invariants.md"
    ]
  },
  "roadmap": {
    "status": "complete",
    "reason": "Capacidad entregada; adopción real separada",
    "sources": [
      "docs/roadmap/README.md"
    ]
  },
  "backlog": {
    "status": "complete",
    "reason": "Adopción y extensión de contratos quedan pendientes sin atribuirles entrega",
    "sources": [
      "docs/governance/pending-decisions.md"
    ]
  },
  "memory": {
    "status": "complete",
    "reason": "Punto activo retirado y trabajadores terminados",
    "sources": [
      ".harness_work/memory/current.md"
    ]
  }
}
