{
  "reviewer": "coordinator",
  "reviewed_at": "2026-10-29T00:07:43.388Z",
  "validation": {
    "status": "complete",
    "reason": "Suites generales y regresiones finales aprobadas, sin proveedores.",
    "sources": [
      ".harness_work/initiatives/20261028_agent_operability/evidence/native-node24.log",
      ".harness_work/initiatives/20261028_agent_operability/evidence/optional-node22.log",
      ".harness_work/initiatives/20261028_agent_operability/evidence/final-focused.log"
    ]
  },
  "reviews": {
    "status": "complete",
    "reason": "Auditoría independiente de consumidor y operabilidad; G1 revalidado, sin bloqueantes.",
    "sources": [
      ".harness_work/initiatives/20261028_agent_operability/reviews/consumer-audit.md",
      ".harness_work/initiatives/20261028_agent_operability/reviews/operability-review.md",
      ".harness_work/initiatives/20261028_agent_operability/audit.md"
    ]
  },
  "documentation": {
    "status": "complete",
    "reason": "Uso canónico distribuido, arquitectura enlaza sin duplicar manual.",
    "sources": [
      "docs/architecture/agent-execution.md"
    ]
  },
  "invariants": {
    "status": "complete",
    "reason": "Guías necesarias disponibles y controladas sin checkout productor.",
    "sources": [
      "docs/invariants.md"
    ]
  },
  "roadmap": {
    "status": "complete",
    "reason": "Capacidad de operación autosuficiente entregada.",
    "sources": [
      "docs/roadmap/README.md"
    ]
  },
  "backlog": {
    "status": "complete",
    "reason": "Se conserva adopción real del equipo y extensiones como próximos resultados.",
    "sources": [
      "docs/roadmap/backlog.md"
    ]
  },
  "memory": {
    "status": "complete",
    "reason": "Retirado expediente activo y conservación de fuentes de contexto.",
    "sources": [
      ".harness_work/memory/current.md"
    ]
  },
  "decisions": {
    "status": "not_applicable",
    "reason": "Se aplican las decisiones vigentes de separación, ejecución y progressive disclosure; no se requiere una arquitectura nueva.",
    "sources": []
  }
}
